{"created_at":"2026-07-20T00:00:00Z","export_id":"export_gj91n8wge7m67qrykz9jj72ttq","export_idempotency_key":"116d063209ace639f9c3a2212e9526650ae0dd00f67203f82ee936e7355df755","exporter_versions":{"warehouse_exporter":"warehouse_export_v1.0.0"},"input_artifacts":[{"artifact_id":"artifact_8dqrx12e541wvg3rzj1tegxe5w","artifact_type":"warehouse.synthetic_input","content_hash":"5bbf4546d3ff6acd41ae96091ce21a3ddde2d812dbd92f21c1e44c2bb095c7ad","record_id":"record_8dqrx12e541wvg3rzj1tegxe5w"}],"logical_hash":"5631c9f4eb9c85049b467bb2cdafafe4427d594d0712eae44226abf4e7cca51a","manifest_relative_path":"exports/export_gj91n8wge7m67qrykz9jj72ttq/manifest.json","manifest_schema_version":"claim_warehouse_export_v1.0.0","row_count":2,"row_counts":{"run":1,"source_media":1},"rows_hash":"5631c9f4eb9c85049b467bb2cdafafe4427d594d0712eae44226abf4e7cca51a","rows_relative_path":"exports/export_gj91n8wge7m67qrykz9jj72ttq/rows.jsonl","run_created_at":"2026-07-20T00:00:00Z","run_id":"run_1z2zwtbt9dvd5cgs3y1wkgdrqy","schema_versions":{"database_schema_version":"truthfulness_db_v02.1.0","warehouse_export_schema_version":"claim_warehouse_export_v1.0.0","warehouse_projection_version":"claim_warehouse_projection_v1.0.0"},"source_registry_prefix":{"head_record_hash":"e2eeef28dd5b8de807bcf8ce72c9fd8eff2688d87e4c5d10280e01ead590b756","head_record_id":"record_8dqrx12e541wvg3rzj1tegxe5w","prefix_hash":"f48601b792fa3de7fbb683d40f8def5cef56c1d1333d56db4e976db6b4e9add6","record_count":1},"storage_root_ref":"ubuntu_v02_claim_warehouse","taxonomy_versions":{"label_taxonomy_version":"truthfulness_taxonomy_v02.1.0"}}
